first_seen,score,track,company,title,location,fit_reason,source,url,posted_at,status,id
2026-07-06T10:46:51+00:00,35,swe,Citadel Securities,Software Engineer Intern,"Miami, FL, NYC","SWE track match, but quant trading focus misaligned.",repo:SimplifyJobs/Summer2026-Internships,https://www.citadelsecurities.com/careers/details/software-engineer-intern-us/,2026-07-06T06:09:57+00:00,new,repo:SimplifyJobs/Summer2026-Internships:c76dbe61-c0f6-47a8-b05e-b219b4e28fb7
2026-07-06T10:46:51+00:00,35,swe,Citadel,Software Engineer Intern,"Greenwich, CT, Houston, TX, Miami, FL, NYC","SWE track match, but quant trading focus misaligned.",repo:SimplifyJobs/Summer2026-Internships,https://www.citadel.com/careers/details/software-engineer-intern-us/,2026-07-06T06:09:01+00:00,new,repo:SimplifyJobs/Summer2026-Internships:28286b52-4c99-4d00-a870-d919c13d68c6
2026-07-06T10:46:51+00:00,30,swe,Susquehanna International Group (SIG),Quantitative Strategy Developer Intern,"Philadelphia, PA",Quant strategy role; minimal ML/AI applied focus.,repo:SimplifyJobs/Summer2026-Internships,https://careers-sig.icims.com/jobs/11170/job?mobile=true&needsRedirect=false,2026-07-06T06:05:43+00:00,new,repo:SimplifyJobs/Summer2026-Internships:5e40a228-3721-4f88-96d5-3f59b73be6c4
2026-07-06T10:46:51+00:00,40,swe,Palantir Technologies,"Software Engineer, Internship - Infrastructure","Palo Alto, CA",Infrastructure SWE; not ML/AI research-focused enough.,repo:jobright-ai/2026-Software-Engineer-Internship,https://jobright.ai/jobs/info/6a4b615b6189f64e437eec95?utm_campaign=1079&utm_source=git,,new,repo:jobright-ai/2026-Software-Engineer-Internship:https://jobright.ai/jobs/info/6a4b615b6189f64e437eec95
2026-07-06T10:46:51+00:00,38,swe,Collaborative Drug Discovery - CDD Vault,Software Engineering Intern,"Newport News, VA","SWE match but drug discovery domain, no ML.",repo:jobright-ai/2026-Software-Engineer-Internship,https://jobright.ai/jobs/info/6a4b41aa5d7b097d2df3cea2?utm_campaign=1079&utm_source=git,,new,repo:jobright-ai/2026-Software-Engineer-Internship:https://jobright.ai/jobs/info/6a4b41aa5d7b097d2df3cea2
2026-07-06T10:46:51+00:00,35,swe,Citadel,Software Engineer – Intern (US),"New York, United States","SWE track match, but quant trading focus misaligned.",repo:jobright-ai/2026-Software-Engineer-Internship,https://jobright.ai/jobs/info/6a4b0ed6c2d11a6a466772d1?utm_campaign=1079&utm_source=git,,new,repo:jobright-ai/2026-Software-Engineer-Internship:https://jobright.ai/jobs/info/6a4b0ed6c2d11a6a466772d1
2026-07-06T10:46:51+00:00,45,swe,TikTok,Software Engineer/Mobile Engineer Intern (Monetization Technology - Ads Core Demonstration) - 2026 Start (BS/MS),San Jose,"Major company, mobile SWE; ads focus, not ML.",repo:jobright-ai/2026-Software-Engineer-Internship,https://jobright.ai/jobs/info/6a3591e67f3fdd180d4ce0f6?utm_campaign=1079&utm_source=git,,new,repo:jobright-ai/2026-Software-Engineer-Internship:https://jobright.ai/jobs/info/6a3591e67f3fdd180d4ce0f6
2026-07-06T10:46:51+00:00,30,swe,CCS,Developer Intern,"Hauppauge, NY","Developer intern; unclear scope, no ML mentioned.",repo:jobright-ai/2026-Software-Engineer-Internship,https://jobright.ai/jobs/info/6a4af1163dbab558e29af6e1?utm_campaign=1079&utm_source=git,,new,repo:jobright-ai/2026-Software-Engineer-Internship:https://jobright.ai/jobs/info/6a4af1163dbab558e29af6e1
2026-07-06T10:46:51+00:00,32,swe,"Persistent Systems, LLC",Intern - Embedded Software Engineer (Summer 2026),"New York, NY",Embedded SWE; not aligned with ML/AI focus.,repo:jobright-ai/2026-Software-Engineer-Internship,https://jobright.ai/jobs/info/6a2d2b7fa1d15e3c552fdd12?utm_campaign=1079&utm_source=git,,new,repo:jobright-ai/2026-Software-Engineer-Internship:https://jobright.ai/jobs/info/6a2d2b7fa1d15e3c552fdd12
2026-07-06T10:46:51+00:00,72,swe,Neuralink,"Software Engineer Intern, Implant","South San Francisco, CA",Neuralink BCI/neurosci SWE; strong domain overlap.,repo:jobright-ai/2026-Software-Engineer-Internship,https://jobright.ai/jobs/info/6a0f4ed372b52f7225f3ca1d?utm_campaign=1079&utm_source=git,,new,repo:jobright-ai/2026-Software-Engineer-Internship:https://jobright.ai/jobs/info/6a0f4ed372b52f7225f3ca1d
2026-07-06T10:46:51+00:00,78,ml,TikTok,AI/ML Software Engineer Intern (Data Platform) - 2026 Summer (BS/MS),San Jose,"TikTok AI/ML; data platform, strong company fit.",repo:jobright-ai/2026-Engineer-Internship,https://jobright.ai/jobs/info/6a38c09f1232144fb15690ee?utm_campaign=1048&utm_source=git,,new,repo:jobright-ai/2026-Engineer-Internship:https://jobright.ai/jobs/info/6a38c09f1232144fb15690ee
2026-07-06T10:46:51+00:00,75,ml,XPENG,AI Infra Onboard Performance Intern,"Santa Clara, CA","AI infra; autonomous systems, strong ML alignment.",repo:jobright-ai/2026-Engineer-Internship,https://jobright.ai/jobs/info/6a365f8f29c90c607e4e4a29?utm_campaign=1048&utm_source=git,,new,repo:jobright-ai/2026-Engineer-Internship:https://jobright.ai/jobs/info/6a365f8f29c90c607e4e4a29
2026-07-06T10:46:51+00:00,32,swe,Tower Research Capital,Quantitative Developer Intern - Summer 2027,"New York, NY",Quant dev summer 2027; trading focus misaligned.,repo:jobright-ai/2026-Engineer-Internship,https://jobright.ai/jobs/info/6a4b1aa3f9cbb100d1ab5440?utm_campaign=1048&utm_source=git,,new,repo:jobright-ai/2026-Engineer-Internship:https://jobright.ai/jobs/info/6a4b1aa3f9cbb100d1ab5440
2026-07-06T10:46:51+00:00,68,ml,Fujitsu,"Research Intern, AI Security","Pittsburgh, PA",Fujitsu AI security research; good research focus.,repo:jobright-ai/2026-Engineer-Internship,https://jobright.ai/jobs/info/6a4b52d4971cd25b06f97505?utm_campaign=1048&utm_source=git,,new,repo:jobright-ai/2026-Engineer-Internship:https://jobright.ai/jobs/info/6a4b52d4971cd25b06f97505
2026-07-06T10:46:51+00:00,82,ml,PlusAI,Machine Learning Engineer Intern - Planning,"Santa Clara, CA","PlusAI ML planning; autonomous, strong fit.",repo:jobright-ai/2026-Engineer-Internship,https://jobright.ai/jobs/info/6a10f1d89fdbf21f36cb19e1?utm_campaign=1048&utm_source=git,,new,repo:jobright-ai/2026-Engineer-Internship:https://jobright.ai/jobs/info/6a10f1d89fdbf21f36cb19e1
2026-07-06T10:46:51+00:00,80,ml,PlusAI,Machine Learning Engineer Intern - Scenario Generation,"Santa Clara, CA",PlusAI ML scenario gen; autonomous vehicles match.,repo:jobright-ai/2026-Engineer-Internship,https://jobright.ai/jobs/info/6a10f20b9f654b3359ceebb5?utm_campaign=1048&utm_source=git,,new,repo:jobright-ai/2026-Engineer-Internship:https://jobright.ai/jobs/info/6a10f20b9f654b3359ceebb5
2026-07-06T10:46:51+00:00,76,ml,PlusAI,Research Engineer Intern - Control,"Santa Clara, CA","PlusAI research control; autonomous, research-heavy.",repo:jobright-ai/2026-Engineer-Internship,https://jobright.ai/jobs/info/6a10f26d83d714428982941d?utm_campaign=1048&utm_source=git,,new,repo:jobright-ai/2026-Engineer-Internship:https://jobright.ai/jobs/info/6a10f26d83d714428982941d
2026-07-06T10:46:51+00:00,79,ml,Visteon Corporation,AI Enabled Autonomous Systems Intern,"Van Buren, MI",Visteon autonomous AI systems; strong CV alignment.,repo:jobright-ai/2026-Engineer-Internship,https://jobright.ai/jobs/info/69d6bffd48f0c8161d2facbd?utm_campaign=1048&utm_source=git,,new,repo:jobright-ai/2026-Engineer-Internship:https://jobright.ai/jobs/info/69d6bffd48f0c8161d2facbd
2026-07-06T14:26:20+00:00,72,ml,cloudflare,"AI Builder Intern – Global Customer Engineering, Service Sales (Fall 2026)",In-Office,"AI focus, global scale, but sales-adjacent vs. hands-on ML.",greenhouse,https://boards.greenhouse.io/cloudflare/jobs/8044395?gh_jid=8044395,2026-07-06T13:28:11+00:00,new,greenhouse:8044395
2026-07-06T14:26:20+00:00,62,swe,Cerebrone.ai,Full Stack Developer Intern,"Charlotte, NC","Full-stack dev, not ML-focused; early-stage startup, limited scope.",repo:jobright-ai/2026-Software-Engineer-Internship,https://jobright.ai/jobs/info/6a4b98134f64ba41dcb5c8d7?utm_campaign=1079&utm_source=git,,new,repo:jobright-ai/2026-Software-Engineer-Internship:https://jobright.ai/jobs/info/6a4b98134f64ba41dcb5c8d7
2026-07-06T14:26:20+00:00,58,swe,TikTok,Software Engineer Intern (Ads Infrastructure) - 2026 Summer (BS/MS),"San Jose, CA","Ads infra SWE, not ML/AI; large company but infrastructure-heavy.",repo:jobright-ai/2026-Software-Engineer-Internship,https://jobright.ai/jobs/info/6a3028ab43732c05812e0ca4?utm_campaign=1079&utm_source=git,,new,repo:jobright-ai/2026-Software-Engineer-Internship:https://jobright.ai/jobs/info/6a3028ab43732c05812e0ca4
2026-07-06T14:26:20+00:00,61,swe,TikTok,Frontend Software Engineer Intern (Ads Measurement Signal and Privacy) - 2026 Summer (BS/MS),"San Jose, CA","Frontend SWE, measurement signal tangential; not core ML/AI.",repo:jobright-ai/2026-Software-Engineer-Internship,https://jobright.ai/jobs/info/6a30297a524fd5657fe0f2ad?utm_campaign=1079&utm_source=git,,new,repo:jobright-ai/2026-Software-Engineer-Internship:https://jobright.ai/jobs/info/6a30297a524fd5657fe0f2ad
2026-07-06T14:26:20+00:00,55,swe,ByteDance,Test Software Engineer Intern (Intelligent Creation) - 2026 Summer (BS/MS),"San Jose, CA","Test/QA role, not ML/AI; ByteDance scale but wrong track.",repo:jobright-ai/2026-Software-Engineer-Internship,https://jobright.ai/jobs/info/6a4b77f16189f64e437ef024?utm_campaign=1079&utm_source=git,,new,repo:jobright-ai/2026-Software-Engineer-Internship:https://jobright.ai/jobs/info/6a4b77f16189f64e437ef024
2026-07-06T14:26:20+00:00,78,data,Plymouth Rock Assurance,Data Science Intern/Co-op,"Boston, MA",Data science direct fit; insurance domain; solid ML opportunity.,repo:jobright-ai/2026-Data-Analysis-Internship,https://jobright.ai/jobs/info/6a2eb4ca7cd40a338faea962?utm_campaign=1066&utm_source=git,,new,repo:jobright-ai/2026-Data-Analysis-Internship:https://jobright.ai/jobs/info/6a2eb4ca7cd40a338faea962
2026-07-06T14:26:20+00:00,48,swe,ByteDance,Security Software Engineer Project Intern (Network Security) - 2026 Start (BS/MS),"San Jose, California, United States of America","Security SWE, not ML/AI; infrastructure-focused, misaligned.",repo:jobright-ai/2026-Engineer-Internship,https://jobright.ai/jobs/info/6a4b866bc2d11a6a46677fed?utm_campaign=1048&utm_source=git,,new,repo:jobright-ai/2026-Engineer-Internship:https://jobright.ai/jobs/info/6a4b866bc2d11a6a46677fed
2026-07-06T14:26:20+00:00,70,swe,Plymouth Rock Assurance,Data Engineer Intern/Co-op,"Boston, MA",Data engineer adjacent; insurance domain; pipeline/infra vs. hands-on ML.,repo:jobright-ai/2026-Engineer-Internship,https://jobright.ai/jobs/info/6a2eb4c7d3ec94183f4c11dc?utm_campaign=1048&utm_source=git,,new,repo:jobright-ai/2026-Engineer-Internship:https://jobright.ai/jobs/info/6a2eb4c7d3ec94183f4c11dc
