first_seen,score,track,company,title,location,fit_reason,source,url,posted_at,status,id
2026-07-05T05:40:41+00:00,15,swe,TikTok,Frontend Engineer Project Intern (TikTok Multimedia Arch) - 2026 (BS/MS),San Jose,Frontend focus misaligned; no ML/AI; wrong seniority track.,repo:jobright-ai/2026-Software-Engineer-Internship,https://jobright.ai/jobs/info/6a49a575971cd25b06f95bbc?utm_campaign=1079&utm_source=git,,new,repo:jobright-ai/2026-Software-Engineer-Internship:https://jobright.ai/jobs/info/6a49a575971cd25b06f95bbc
2026-07-05T05:40:41+00:00,8,swe,Blue Origin,Spring 2027 Software Developer Internship - Graduate,Greater Seattle Area,Graduate-only dealbreaker; candidate is undergrad through May 2029.,repo:jobright-ai/2026-Software-Engineer-Internship,https://jobright.ai/jobs/info/6a2a2b72495d985b99427753?utm_campaign=1079&utm_source=git,,new,repo:jobright-ai/2026-Software-Engineer-Internship:https://jobright.ai/jobs/info/6a2a2b72495d985b99427753
2026-07-05T10:51:55+00:00,62,swe,droyd,Software Engineering Intern,"San Francisco, CA","SWE track match, but lacks ML/AI focus candidate prioritizes.",ashby,https://jobs.ashbyhq.com/droyd/8d46ed05-1b38-4c68-938e-f10b4c7d4694,2024-06-06T20:33:14.190000+00:00,new,ashby:8d46ed05-1b38-4c68-938e-f10b4c7d4694
2026-07-05T12:16:47+00:00,72,ml,TikTok,GPU/AI Application System Software Engineer Intern (System Technologies and Engineering) - 2026 Summer (BS/MS),"San Jose, CA","Strong ML/systems fit, GPU optimization aligns well, top company, timing works",repo:jobright-ai/2026-Software-Engineer-Internship,https://jobright.ai/jobs/info/6a30d206524fd5657fe1249c?utm_campaign=1079&utm_source=git,,new,repo:jobright-ai/2026-Software-Engineer-Internship:https://jobright.ai/jobs/info/6a30d206524fd5657fe1249c
2026-07-05T14:16:18+00:00,45,swe,Copart,Software Engineering Intern,"Dallas, TX","SWE track match, but generic role lacks ML/AI focus",repo:jobright-ai/2026-Software-Engineer-Internship,https://jobright.ai/jobs/info/69a7b7d776bbe83d3afb2b02?utm_campaign=1079&utm_source=git,,new,repo:jobright-ai/2026-Software-Engineer-Internship:https://jobright.ai/jobs/info/69a7b7d776bbe83d3afb2b02
2026-07-05T14:16:18+00:00,82,ml,PlusAI,Machine Learning Engineer Intern - Planning,"Santa Clara, CA","ML internship, planning domain, strong PyTorch/CV skills fit",repo:jobright-ai/2026-Engineer-Internship,https://jobright.ai/jobs/info/6a10818b69bd827926aeebc3?utm_campaign=1048&utm_source=git,,new,repo:jobright-ai/2026-Engineer-Internship:https://jobright.ai/jobs/info/6a10818b69bd827926aeebc3
2026-07-05T14:16:18+00:00,80,ml,PlusAI,Machine Learning Engineer Intern - Scenario Generation,"Santa Clara, CA","ML internship, scenario generation, CV/ML expertise highly relevant",repo:jobright-ai/2026-Engineer-Internship,https://jobright.ai/jobs/info/6a1b0dcb547e292ae139bf19?utm_campaign=1048&utm_source=git,,new,repo:jobright-ai/2026-Engineer-Internship:https://jobright.ai/jobs/info/6a1b0dcb547e292ae139bf19
2026-07-05T14:16:18+00:00,78,ml,PlusAI,Research Engineer Intern - Control,"Santa Clara, CA","Research engineer role, control systems, strong research background",repo:jobright-ai/2026-Engineer-Internship,https://jobright.ai/jobs/info/6a10819012f8b43cf398586b?utm_campaign=1048&utm_source=git,,new,repo:jobright-ai/2026-Engineer-Internship:https://jobright.ai/jobs/info/6a10819012f8b43cf398586b
