first_seen,score,track,company,title,location,fit_reason,source,url,posted_at,status,id
2026-07-19T10:54:43+00:00,72,swe,TikTok,(General Hire) Software Engineer Intern (TikTok Eng-Short Video) - 2026 Summer (BS/MS),"San Jose, CA, United States","Strong SWE match, tier-1 company, summer 2026 timing good",repo:jobright-ai/2026-Software-Engineer-Internship,https://jobright.ai/jobs/info/6a5be2db686b4755d1e1a8c2?utm_campaign=1079&utm_source=git,,new,repo:jobright-ai/2026-Software-Engineer-Internship:https://jobright.ai/jobs/info/6a5be2db686b4755d1e1a8c2
2026-07-19T10:54:43+00:00,45,swe,Cadence,Software Engineering Intern,"Pittsburgh, PA, United States","SWE track match, but no ML/AI focus, location neutral",repo:jobright-ai/2026-Software-Engineer-Internship,https://jobright.ai/jobs/info/6a554497ae07d60a8d010064?utm_campaign=1079&utm_source=git,,new,repo:jobright-ai/2026-Software-Engineer-Internship:https://jobright.ai/jobs/info/6a554497ae07d60a8d010064
2026-07-19T10:54:43+00:00,45,swe,Cadence,Software Engineering Intern,"PITTSBURGH 03, United States of America","Duplicate of #1, SWE-only, no ML/AI component",repo:jobright-ai/2026-Software-Engineer-Internship,https://jobright.ai/jobs/info/6a50f662bf63b66c79977a5c?utm_campaign=1079&utm_source=git,,new,repo:jobright-ai/2026-Software-Engineer-Internship:https://jobright.ai/jobs/info/6a50f662bf63b66c79977a5c
2026-07-19T10:54:43+00:00,42,swe,Prospect Equities®,Backend / Frontend Developer Intern,"Chicago, IL, United States","Backend/frontend SWE, no ML/AI, early-stage company",repo:jobright-ai/2026-Software-Engineer-Internship,https://jobright.ai/jobs/info/6a5bc2283ac7627fe9009018?utm_campaign=1079&utm_source=git,,new,repo:jobright-ai/2026-Software-Engineer-Internship:https://jobright.ai/jobs/info/6a5bc2283ac7627fe9009018
2026-07-19T10:54:43+00:00,48,swe,Neptune.io,"Software Engineer (Full-time, part-time, or Intern)","Seattle, WA - Washington, United States","MLOps-adjacent (tool for ML), SWE track, limited AI focus",repo:jobright-ai/2026-Software-Engineer-Internship,https://jobright.ai/jobs/info/6a5b8bbe686b4755d1e19cb7?utm_campaign=1079&utm_source=git,,new,repo:jobright-ai/2026-Software-Engineer-Internship:https://jobright.ai/jobs/info/6a5b8bbe686b4755d1e19cb7
2026-07-19T10:54:43+00:00,50,swe,Zipline,Software Engineer Intern (Fall 2026),"South San Francisco, CA, United States","SWE intern, Fall 2026 timing suboptimal, no ML/AI signals",repo:jobright-ai/2026-Software-Engineer-Internship,https://jobright.ai/jobs/info/6a556dae268af95237bebd68?utm_campaign=1079&utm_source=git,,new,repo:jobright-ai/2026-Software-Engineer-Internship:https://jobright.ai/jobs/info/6a556dae268af95237bebd68
2026-07-19T10:54:43+00:00,40,swe,Ramp,"Software Engineer Internship, Android","New York, NY, United States","Android engineering, no ML/AI, niche mobile focus",repo:jobright-ai/2026-Software-Engineer-Internship,https://jobright.ai/jobs/info/6a560bb9efb06a45240d3604?utm_campaign=1079&utm_source=git,,new,repo:jobright-ai/2026-Software-Engineer-Internship:https://jobright.ai/jobs/info/6a560bb9efb06a45240d3604
2026-07-19T10:54:43+00:00,43,swe,Hermeus,Software Engineering Intern (HMI) - Fall 2026,"Atlanta, GA, United States","Aerospace SWE, Fall 2026 timing weak, no ML/AI fit",repo:jobright-ai/2026-Software-Engineer-Internship,https://jobright.ai/jobs/info/6a5b33d1856af468ab00c2a9?utm_campaign=1079&utm_source=git,,new,repo:jobright-ai/2026-Software-Engineer-Internship:https://jobright.ai/jobs/info/6a5b33d1856af468ab00c2a9
2026-07-19T10:54:43+00:00,55,swe,Feather Robotics,"Software Engineering Intern, Teleoperation",San Francisco Bay Area,"Robotics SWE, potential CV/systems work, but unclear ML depth",repo:jobright-ai/2026-Software-Engineer-Internship,https://jobright.ai/jobs/info/6a5b19cf3ac7627fe90075c5?utm_campaign=1079&utm_source=git,,new,repo:jobright-ai/2026-Software-Engineer-Internship:https://jobright.ai/jobs/info/6a5b19cf3ac7627fe90075c5
2026-07-19T10:54:43+00:00,25,swe,Bridge-it App Inc,Remote Backend Python Engineer Internship (Unpaid) - BridgeItApp.org,"Truckee, CA, United States","Unpaid, remote Python backend, weak company signal, no ML",repo:jobright-ai/2026-Software-Engineer-Internship,https://jobright.ai/jobs/info/6a5ae9ce856af468ab00addb?utm_campaign=1079&utm_source=git,,new,repo:jobright-ai/2026-Software-Engineer-Internship:https://jobright.ai/jobs/info/6a5ae9ce856af468ab00addb
2026-07-19T10:54:43+00:00,48,swe,Career Launch Tech Initiative,Software Engineering Intern,"Los Angeles, CA, United States","SWE intern, LA-based, no clear ML/AI differentiation",repo:jobright-ai/2026-Software-Engineer-Internship,https://jobright.ai/jobs/info/6a5adcfdc8e3a473cb8ad5fd?utm_campaign=1079&utm_source=git,,new,repo:jobright-ai/2026-Software-Engineer-Internship:https://jobright.ai/jobs/info/6a5adcfdc8e3a473cb8ad5fd
2026-07-19T10:54:43+00:00,65,swe,TikTok,Frontend Engineer Intern (Ads Interface and Platform) - 2026 Summer (BS/MS),"San Jose, United States","TikTok frontend, tier-1 company, summer 2026, SWE track good",repo:jobright-ai/2026-Software-Engineer-Internship,https://jobright.ai/jobs/info/6a5ad5ff3ac7627fe90056e5?utm_campaign=1079&utm_source=git,,new,repo:jobright-ai/2026-Software-Engineer-Internship:https://jobright.ai/jobs/info/6a5ad5ff3ac7627fe90056e5
2026-07-19T10:54:43+00:00,44,swe,Ciena,Embedded Software Engineer – Intern,"Ottawa, Canada","Embedded SWE, Canada location, no ML/AI focus",repo:jobright-ai/2026-Software-Engineer-Internship,https://jobright.ai/jobs/info/6a52a0cbd007ee02d95f856f?utm_campaign=1079&utm_source=git,,new,repo:jobright-ai/2026-Software-Engineer-Internship:https://jobright.ai/jobs/info/6a52a0cbd007ee02d95f856f
2026-07-19T10:54:43+00:00,28,product,RG&T Solutions,Remote Crypto SaaS Product Manager Intern,"Glendale, AZ, United States","Crypto PM, not SWE/ML, product-only, misaligned",repo:jobright-ai/2026-Product-Management-Internship,https://jobright.ai/jobs/info/6a5b142f686b4755d1e182c4?utm_campaign=1047&utm_source=git,,new,repo:jobright-ai/2026-Product-Management-Internship:https://jobright.ai/jobs/info/6a5b142f686b4755d1e182c4
2026-07-19T10:54:43+00:00,68,ml,Siemens Digital Industries Software,"Strategic Student Program: Product Strategy & AI Automation Internship (Fall 2026, SIM)",United States,"AI Automation + product strategy, fall 2026, strong AI fit",repo:jobright-ai/2026-Product-Management-Internship,https://jobright.ai/jobs/info/6a5b01c6856af468ab00b45e?utm_campaign=1047&utm_source=git,,new,repo:jobright-ai/2026-Product-Management-Internship:https://jobright.ai/jobs/info/6a5b01c6856af468ab00b45e
2026-07-19T10:54:43+00:00,82,data,Ensemble Health Partners,Data Scientist Intern,United States,"Data scientist role, ML track, healthcare domain, excellent skill match",repo:jobright-ai/2026-Data-Analysis-Internship,https://jobright.ai/jobs/info/6a5ae786686b4755d1e17674?utm_campaign=1066&utm_source=git,,new,repo:jobright-ai/2026-Data-Analysis-Internship:https://jobright.ai/jobs/info/6a5ae786686b4755d1e17674
2026-07-19T10:54:43+00:00,82,data,Ensemble Health Partners,Data Scientist Intern,United States,"Duplicate of #15, data science, ML track, strong fit",repo:jobright-ai/2026-Data-Analysis-Internship,https://jobright.ai/jobs/info/6a5ae336856af468ab00a823?utm_campaign=1066&utm_source=git,,new,repo:jobright-ai/2026-Data-Analysis-Internship:https://jobright.ai/jobs/info/6a5ae336856af468ab00a823
2026-07-19T10:54:43+00:00,75,data,Nokia,Data Science Co-op/Intern,"Ottawa, Ontario, Canada","Data science co-op, ML track, Nokia tier-1, Canada location",repo:jobright-ai/2026-Data-Analysis-Internship,https://jobright.ai/jobs/info/6a5ae34ac8e3a473cb8adb24?utm_campaign=1066&utm_source=git,,new,repo:jobright-ai/2026-Data-Analysis-Internship:https://jobright.ai/jobs/info/6a5ae34ac8e3a473cb8adb24
2026-07-19T10:54:43+00:00,52,swe,TikTok,Security Software Engineer Project Intern (Product Security) - 2026 Start (BS/MS),"San Jose, CA, United States","Security engineering, TikTok tier-1, but not ML/AI focus",repo:jobright-ai/2026-Engineer-Internship,https://jobright.ai/jobs/info/6a5b8e97856af468ab00d1c9?utm_campaign=1048&utm_source=git,,new,repo:jobright-ai/2026-Engineer-Internship:https://jobright.ai/jobs/info/6a5b8e97856af468ab00d1c9
2026-07-19T11:58:34+00:00,42,ml,ASM Global,Automation & AI Technology Experience Intern,"West Conshohocken, PA, United States of America","AI track match, but vague scope & location mismatch",repo:jobright-ai/2026-Engineer-Internship,https://jobright.ai/jobs/info/6a52a1288a74e077472f55a0?utm_campaign=1048&utm_source=git,,new,repo:jobright-ai/2026-Engineer-Internship:https://jobright.ai/jobs/info/6a52a1288a74e077472f55a0
2026-07-19T13:42:58+00:00,82,ml,Huawei Canada,Intern Researcher - Embodied AI,"Markham, ON, Canada","Strong AI/ML fit, embodied AI aligns with CV expertise, research-focused role matches profile",repo:jobright-ai/2026-Engineer-Internship,https://jobright.ai/jobs/info/6a5caeae3ac7627fe900afb4?utm_campaign=1048&utm_source=git,,new,repo:jobright-ai/2026-Engineer-Internship:https://jobright.ai/jobs/info/6a5caeae3ac7627fe900afb4
