first_seen,score,track,company,title,location,fit_reason,source,url,posted_at,status,id
2026-07-14T19:20:18+00:00,5,swe,Codeage,Web Developer Intern - WordPress and Woocommerce,"449 S Beverly Dr, Beverly Hills, CA 90212, United States","WordPress/Woocommerce web dev, zero ML/AI alignment",repo:jobright-ai/2026-Software-Engineer-Internship,https://jobright.ai/jobs/info/6a566620e9b77f668bd63172?utm_campaign=1079&utm_source=git,,new,repo:jobright-ai/2026-Software-Engineer-Internship:https://jobright.ai/jobs/info/6a566620e9b77f668bd63172
2026-07-14T19:20:18+00:00,72,ml,SoKat,🚀 AI & AR/VR Innovation Intern,"Baltimore, MD, United States","AI/AR/VR innovation aligns well, but vague scope unclear",repo:jobright-ai/2026-Software-Engineer-Internship,https://jobright.ai/jobs/info/6a565fc410c4d945d8649177?utm_campaign=1079&utm_source=git,,new,repo:jobright-ai/2026-Software-Engineer-Internship:https://jobright.ai/jobs/info/6a565fc410c4d945d8649177
2026-07-14T19:20:18+00:00,15,swe,TMX Group,Software Engineer Intern (Java),"Toronto - 100 Adelaide St W, Canada","Java SWE, no ML focus, Canada location not preferred",repo:jobright-ai/2026-Software-Engineer-Internship,https://jobright.ai/jobs/info/6a565f2910c4d945d8649111?utm_campaign=1079&utm_source=git,,new,repo:jobright-ai/2026-Software-Engineer-Internship:https://jobright.ai/jobs/info/6a565f2910c4d945d8649111
2026-07-14T19:20:18+00:00,20,swe,SoloPulse,Software Engineer Intern/Co-Op - Fall 2026,"Peachtree Corners, GA, United States","Generic SWE co-op, no ML/AI mention, fall timing",repo:jobright-ai/2026-Software-Engineer-Internship,https://jobright.ai/jobs/info/6a565df253b3962b910af9ea?utm_campaign=1079&utm_source=git,,new,repo:jobright-ai/2026-Software-Engineer-Internship:https://jobright.ai/jobs/info/6a565df253b3962b910af9ea
2026-07-14T19:20:18+00:00,8,swe,Palantir Technologies,"Year at Palantir - Forward Deployed Software Engineer, Internship - USG","Washington, DC, United States",USG security clearance required—hard dealbreaker,repo:jobright-ai/2026-Software-Engineer-Internship,https://jobright.ai/jobs/info/6a066ef3f3d6cc51d63938ae?utm_campaign=1079&utm_source=git,,new,repo:jobright-ai/2026-Software-Engineer-Internship:https://jobright.ai/jobs/info/6a066ef3f3d6cc51d63938ae
2026-07-14T19:20:18+00:00,75,ml,"Veracyte, Inc.","Intern, AI (PMO)",United States,AI internship matches track/skills; PMO scope slightly unclear,repo:jobright-ai/2026-Engineer-Internship,https://jobright.ai/jobs/info/6a56638621f64463ad3541d4?utm_campaign=1048&utm_source=git,,new,repo:jobright-ai/2026-Engineer-Internship:https://jobright.ai/jobs/info/6a56638621f64463ad3541d4
2026-07-14T20:38:07+00:00,25,swe,NextGen Federal Systems,Software Engineering Intern,United States,Federal/clearance likely required; SWE track OK but vague posting,repo:jobright-ai/2026-Software-Engineer-Internship,https://jobright.ai/jobs/info/6a567a12efb06a45240d6007?utm_campaign=1079&utm_source=git,,new,repo:jobright-ai/2026-Software-Engineer-Internship:https://jobright.ai/jobs/info/6a567a12efb06a45240d6007
2026-07-14T20:38:07+00:00,78,swe,Five Rings,Summer Intern 2027 - Software Developer,"New York, NY, United States","Strong SWE + ML track, summer 2027 ideal timing, HFT/quant edge case",repo:jobright-ai/2026-Software-Engineer-Internship,https://jobright.ai/jobs/info/6a5677e1f7517b519ad55dae?utm_campaign=1079&utm_source=git,,new,repo:jobright-ai/2026-Software-Engineer-Internship:https://jobright.ai/jobs/info/6a5677e1f7517b519ad55dae
2026-07-14T20:38:07+00:00,65,data,The World Bank Group,WBG Pioneer - Data Scientist Intern,"Washington, DC, United States","Data science role matches, non-ML focus, government/international focus",repo:jobright-ai/2026-Data-Analysis-Internship,https://jobright.ai/jobs/info/6a567b8c53b3962b910b06b8?utm_campaign=1066&utm_source=git,,new,repo:jobright-ai/2026-Data-Analysis-Internship:https://jobright.ai/jobs/info/6a567b8c53b3962b910b06b8
2026-07-14T20:38:07+00:00,15,data,National Laboratory of the Rockies,Graduate (Year-Round) Intern: Geospatial Data Science Modeling and Analysis,"Golden, CO, United States","Graduate/year-round only, geospatial niche, undergrad dealbreaker",repo:jobright-ai/2026-Data-Analysis-Internship,https://jobright.ai/jobs/info/6a511d458d7d3e6cf1cbf0c8?utm_campaign=1066&utm_source=git,,new,repo:jobright-ai/2026-Data-Analysis-Internship:https://jobright.ai/jobs/info/6a511d458d7d3e6cf1cbf0c8
2026-07-14T20:38:07+00:00,70,ml,NextGen Federal Systems,Data Science & Machine Learning Intern,United States,"ML/DS track strong match, federal clearance likely dealbreaker",repo:jobright-ai/2026-Engineer-Internship,https://jobright.ai/jobs/info/6a567a37f7517b519ad55e47?utm_campaign=1048&utm_source=git,,new,repo:jobright-ai/2026-Engineer-Internship:https://jobright.ai/jobs/info/6a567a37f7517b519ad55e47
2026-07-14T20:38:07+00:00,72,ml,Festo,AI Engineer Intern,"Islandia, FL, United States","AI engineer role, robotics/hardware CV edge case, less typical ML domain",repo:jobright-ai/2026-Engineer-Internship,https://jobright.ai/jobs/info/6a56699e10c4d945d8649778?utm_campaign=1048&utm_source=git,,new,repo:jobright-ai/2026-Engineer-Internship:https://jobright.ai/jobs/info/6a56699e10c4d945d8649778
2026-07-14T21:38:33+00:00,15,swe,Leesee,Développeur Web ou Mobile (Stage Cégep) / Web or Mobile Developer (Cegep Internship),"Montreal, Quebec, Canada","Web/mobile dev, not ML/AI focus. Wrong track.",repo:jobright-ai/2026-Software-Engineer-Internship,https://jobright.ai/jobs/info/6a5684f910c4d945d864a2fe?utm_campaign=1079&utm_source=git,,new,repo:jobright-ai/2026-Software-Engineer-Internship:https://jobright.ai/jobs/info/6a5684f910c4d945d864a2fe
2026-07-14T21:38:33+00:00,78,ml,Rivian,UIUC Research Park Intern - Machine Learning Compiler,"Champaign, IL, United States","ML compiler work, strong CV foundation. Less applied ML than ideal.",repo:jobright-ai/2026-Engineer-Internship,https://jobright.ai/jobs/info/6a56921ef7517b519ad5687c?utm_campaign=1048&utm_source=git,,new,repo:jobright-ai/2026-Engineer-Internship:https://jobright.ai/jobs/info/6a56921ef7517b519ad5687c
2026-07-14T21:38:33+00:00,82,ml,SAP,SAP iXp Intern - AI Engineer,"Palo Alto, CA, United States","AI engineer, top company. Broader role, excellent visibility.",repo:jobright-ai/2026-Engineer-Internship,https://jobright.ai/jobs/info/6a555bf1377f983ce8a99a3c?utm_campaign=1048&utm_source=git,,new,repo:jobright-ai/2026-Engineer-Internship:https://jobright.ai/jobs/info/6a555bf1377f983ce8a99a3c
2026-07-14T21:38:33+00:00,5,swe,Ohio BWC (official),College Intern - Ohio Homeland Security Critical Infrastructure Unit,"Columbus, OH, United States",Security clearance required. Hard dealbreaker.,repo:jobright-ai/2026-Engineer-Internship,https://jobright.ai/jobs/info/6a56882921f64463ad3553ff?utm_campaign=1048&utm_source=git,,new,repo:jobright-ai/2026-Engineer-Internship:https://jobright.ai/jobs/info/6a56882921f64463ad3553ff
2026-07-14T21:38:33+00:00,65,ml,MyEmployment,AI Operations & Automation Intern,United States,"AI/automation ops, decent fit. Less research/applied ML focused.",repo:jobright-ai/2026-Engineer-Internship,https://jobright.ai/jobs/info/6a5683d821f64463ad3551e6?utm_campaign=1048&utm_source=git,,new,repo:jobright-ai/2026-Engineer-Internship:https://jobright.ai/jobs/info/6a5683d821f64463ad3551e6
2026-07-14T21:38:33+00:00,72,ml,ByteDance,Machine Learning Engineer Intern (Global E-commerce Risk Control) - 2026 Summer (BS/MS),"Seattle, WA, United States","ML engineer, ByteDance prestige. Risk control less CV-aligned.",repo:jobright-ai/2026-Engineer-Internship,https://jobright.ai/jobs/info/6a56831af7517b519ad56378?utm_campaign=1048&utm_source=git,,new,repo:jobright-ai/2026-Engineer-Internship:https://jobright.ai/jobs/info/6a56831af7517b519ad56378
